{
  "schema_version": 1,
  "format": "capplusplus_feature_parity",
  "baseline": "Steam Capitalism Plus 1.01 per ROADMAP.md; candidate feature ledger, pending a target-specific manual and observation crosswalk.",
  "manual_crosswalk_status": "pending",
  "dimensions": [
    "data",
    "simulation",
    "ui",
    "persistence",
    "ai",
    "multiplayer"
  ],
  "features": [
    {
      "id": "setup",
      "title": "Setup and game modes",
      "target": "0.5",
      "requirements": [
        "Instructional, normal, scenario and load modes",
        "Game sets, industry selection, competitors, capital and difficulty",
        "Goals, winning, losing and scores"
      ],
      "reference_status": "needs_reference_check",
      "evidence": [
        "ROADMAP.md"
      ],
      "content_families": [
        "game_sets",
        "configuration"
      ],
      "status": {
        "data": "not_started",
        "simulation": "not_started",
        "ui": "not_started",
        "persistence": "not_started",
        "ai": "not_started",
        "multiplayer": "not_started"
      },
      "tests": [],
      "notes": "Inspector progress does not count as native-engine parity. Add exact manual/experiment references before marking validated; split this row when independently testable subfeatures diverge."
    },
    {
      "id": "calendar",
      "title": "Calendar and simulation control",
      "target": "0.5",
      "requirements": [
        "Calendar boundaries",
        "Pause and all speed levels",
        "Fixed command ordering and RNG call ordering"
      ],
      "reference_status": "needs_reference_check",
      "evidence": [
        "ROADMAP.md"
      ],
      "content_families": [
        "saves"
      ],
      "status": {
        "data": "not_started",
        "simulation": "not_started",
        "ui": "not_started",
        "persistence": "not_started",
        "ai": "not_started",
        "multiplayer": "not_started"
      },
      "tests": [],
      "notes": "Inspector progress does not count as native-engine parity. Add exact manual/experiment references before marking validated; split this row when independently testable subfeatures diverge."
    },
    {
      "id": "world_views",
      "title": "World maps and navigation",
      "target": "0.4",
      "requirements": [
        "Regional and detailed maps",
        "Panning, selection, map modes, filters and display modes"
      ],
      "reference_status": "needs_reference_check",
      "evidence": [
        "ROADMAP.md"
      ],
      "content_families": [
        "maps",
        "resource_images",
        "terrain_table"
      ],
      "status": {
        "data": "not_started",
        "simulation": "not_started",
        "ui": "not_started",
        "persistence": "not_started",
        "ai": "not_started",
        "multiplayer": "not_started"
      },
      "tests": [],
      "notes": "Inspector progress does not count as native-engine parity. Add exact manual/experiment references before marking validated; split this row when independently testable subfeatures diverge."
    },
    {
      "id": "town_markets",
      "title": "Towns and local competition",
      "target": "0.5",
      "requirements": [
        "Population and consumer markets",
        "Local competitors",
        "Imports and external supply"
      ],
      "reference_status": "needs_reference_check",
      "evidence": [
        "ROADMAP.md"
      ],
      "content_families": [
        "game_sets",
        "maps",
        "saves"
      ],
      "status": {
        "data": "not_started",
        "simulation": "not_started",
        "ui": "not_started",
        "persistence": "not_started",
        "ai": "not_started",
        "multiplayer": "not_started"
      },
      "tests": [],
      "notes": "Inspector progress does not count as native-engine parity. Add exact manual/experiment references before marking validated; split this row when independently testable subfeatures diverge."
    },
    {
      "id": "construction",
      "title": "Firm construction",
      "target": "0.5",
      "requirements": [
        "Build/demolish, site rules and naming",
        "Nine-slot layout and selection"
      ],
      "reference_status": "needs_reference_check",
      "evidence": [
        "ROADMAP.md"
      ],
      "content_families": [
        "game_sets",
        "resource_images",
        "layout_plans"
      ],
      "status": {
        "data": "not_started",
        "simulation": "not_started",
        "ui": "not_started",
        "persistence": "not_started",
        "ai": "not_started",
        "multiplayer": "not_started"
      },
      "tests": [],
      "notes": "Inspector progress does not count as native-engine parity. Add exact manual/experiment references before marking validated; split this row when independently testable subfeatures diverge."
    },
    {
      "id": "unit_links",
      "title": "Functional-unit links",
      "target": "0.5",
      "requirements": [
        "Input/output links",
        "Internal sale",
        "Supplier selection and auto purchase"
      ],
      "reference_status": "needs_reference_check",
      "evidence": [
        "ROADMAP.md"
      ],
      "content_families": [
        "layout_plans",
        "game_sets"
      ],
      "status": {
        "data": "not_started",
        "simulation": "not_started",
        "ui": "not_started",
        "persistence": "not_started",
        "ai": "not_started",
        "multiplayer": "not_started"
      },
      "tests": [],
      "notes": "Inspector progress does not count as native-engine parity. Add exact manual/experiment references before marking validated; split this row when independently testable subfeatures diverge."
    },
    {
      "id": "stores",
      "title": "Department stores",
      "target": "0.5",
      "requirements": [
        "Purchasing, inventory and sales units",
        "Store summaries and control panels"
      ],
      "reference_status": "needs_reference_check",
      "evidence": [
        "ROADMAP.md"
      ],
      "content_families": [
        "game_sets",
        "layout_plans"
      ],
      "status": {
        "data": "not_started",
        "simulation": "not_started",
        "ui": "not_started",
        "persistence": "not_started",
        "ai": "not_started",
        "multiplayer": "not_started"
      },
      "tests": [],
      "notes": "Inspector progress does not count as native-engine parity. Add exact manual/experiment references before marking validated; split this row when independently testable subfeatures diverge."
    },
    {
      "id": "factories",
      "title": "Factories",
      "target": "0.5",
      "requirements": [
        "Multi-input recipes",
        "Manufacturing, capacity and utilization",
        "Costs, bottlenecks and inventory"
      ],
      "reference_status": "needs_reference_check",
      "evidence": [
        "ROADMAP.md"
      ],
      "content_families": [
        "game_sets",
        "layout_plans"
      ],
      "status": {
        "data": "not_started",
        "simulation": "not_started",
        "ui": "not_started",
        "persistence": "not_started",
        "ai": "not_started",
        "multiplayer": "not_started"
      },
      "tests": [],
      "notes": "Inspector progress does not count as native-engine parity. Add exact manual/experiment references before marking validated; split this row when independently testable subfeatures diverge."
    },
    {
      "id": "farms",
      "title": "Farms",
      "target": "0.6",
      "requirements": [
        "Crop seasons, soil and site effects",
        "Livestock raising and processing",
        "Yield, spoilage and quality"
      ],
      "reference_status": "needs_reference_check",
      "evidence": [
        "ROADMAP.md"
      ],
      "content_families": [
        "game_sets",
        "game_set_images"
      ],
      "status": {
        "data": "not_started",
        "simulation": "not_started",
        "ui": "not_started",
        "persistence": "not_started",
        "ai": "not_started",
        "multiplayer": "not_started"
      },
      "tests": [],
      "notes": "Inspector progress does not count as native-engine parity. Add exact manual/experiment references before marking validated; split this row when independently testable subfeatures diverge."
    },
    {
      "id": "extraction",
      "title": "Raw-material extraction",
      "target": "0.6",
      "requirements": [
        "Mines, oil wells and logging camps",
        "Discovery, reserves, extraction and depletion"
      ],
      "reference_status": "needs_reference_check",
      "evidence": [
        "ROADMAP.md"
      ],
      "content_families": [
        "game_sets",
        "maps"
      ],
      "status": {
        "data": "not_started",
        "simulation": "not_started",
        "ui": "not_started",
        "persistence": "not_started",
        "ai": "not_started",
        "multiplayer": "not_started"
      },
      "tests": [],
      "notes": "Inspector progress does not count as native-engine parity. Add exact manual/experiment references before marking validated; split this row when independently testable subfeatures diverge."
    },
    {
      "id": "research",
      "title": "Research and development",
      "target": "0.6",
      "requirements": [
        "R&D centers and units",
        "Technology, new products and quality effects"
      ],
      "reference_status": "needs_reference_check",
      "evidence": [
        "ROADMAP.md"
      ],
      "content_families": [
        "game_sets"
      ],
      "status": {
        "data": "not_started",
        "simulation": "not_started",
        "ui": "not_started",
        "persistence": "not_started",
        "ai": "not_started",
        "multiplayer": "not_started"
      },
      "tests": [],